{
  "_id": "0987654321",
  "type": "audio",
  "version": "0.10.5",
  "source_url": "https://www.washingtonpost.com/audio/foo/bar.mp3",
  "mimetype": "audio/mp3",
  "credits": {
    "by": [
      {
        "type": "author",
        "version": "0.10.5",
        "name": "John Jacob",
        "byline": "John Jacob"
      }
    ]
  },
  "additional_properties": {
    "foo": "bar"
  }
}
